C:\files\Papers\embedded\LPC2148\usb_eth>c:\programs\WinDump -D
1.\Device\NPF_{3A06A208-2976-4065-8500-A69C1E2396E8} (Intel(R) PRO/Wireless 3945
ABG Network Connection (Microsoft's Packet Scheduler) )
2.\Device\NPF_{45E6593F-7A29-447A-8B39-EFADBBF19877} (Sivan Toledo)
3.\Device\NPF_{209D8C09-66A5-4996-9C74-EFC03EF65D85} (MS LoopBack Driver)
4.\Device\NPF_{34227523-1C57-41E6-BEBB-72BD3B1270DA} (Broadcom NetXtreme Gigabit
 Ethernet Driver (Microsoft's Packet Scheduler) )

C:\files\Papers\embedded\LPC2148\usb_eth>c:\programs\WinDump -i \Device\NPF_{45E
6593F-7A29-447A-8B39-EFADBBF19877}
c:\programs\WinDump: listening on \Device\NPF_{45E6593F-7A29-447A-8B39-EFADBBF19
877}
11:36:11.695811 IP 192.168.12.2.5353 > 224.0.0.251.5353:  0 [2a] PTR? _sip._udp.
local. (146)
11:36:12.303345 IP 192.168.12.2.5353 > 224.0.0.251.5353:  0*- [0q] 9/0/0[|domain
]
11:36:12.849669 IP 192.168.12.2.137 > 224.0.0.251.137: UDP, length 50
11:36:14.349087 IP 192.168.12.2.137 > 224.0.0.251.137: UDP, length 50
11:36:15.647089 arp who-has 192.168.12.99 tell 192.168.12.2
11:36:15.717212 arp reply 192.168.12.99 is-at de:ad:be:ef:ab:ba (oui Unknown)
11:36:15.717237 IP 192.168.12.2.1261 > 192.168.12.99.23: S 183590924:183590924(0
) win 16384 <mss 1460,nop,nop,sackOK>
11:36:15.850291 IP 192.168.12.2.137 > 224.0.0.251.137: UDP, length 50
11:36:16.067223 IP 192.168.12.99.23 > 192.168.12.2.1261: S 1480:1480(0) ack 1835
90925 win 1446 <mss 1446>
11:36:17.350802 IP 192.168.12.2.137 > 224.0.0.251.137: UDP, length 50
11:36:18.617839 IP 192.168.12.2.1261 > 192.168.12.99.23: S 183590924:183590924(0
) win 16384 <mss 1460,nop,nop,sackOK>
11:36:18.850315 IP 192.168.12.2.137 > 224.0.0.251.137: UDP, length 50
11:36:18.932352 IP 192.168.12.99.23 > 192.168.12.2.1261: . ack 1 win 1446
11:36:19.439344 IP 192.168.12.99.23 > 192.168.12.2.1261: S 1480:1480(0) ack 1835
90925 win 1446 <mss 1446>
11:36:20.350315 IP 192.168.12.2.137 > 224.0.0.251.137: UDP, length 50
11:36:23.474477 IP 192.168.12.99.23 > 192.168.12.2.1261: S 1480:1480(0) ack 1835
90925 win 1446 <mss 1446>
11:36:24.652815 IP 192.168.12.2.1261 > 192.168.12.99.23: S 183590924:183590924(0
) win 16384 <mss 1460,nop,nop,sackOK>
11:36:24.947521 IP 192.168.12.99.23 > 192.168.12.2.1261: . ack 1 win 1446
11:36:25.960998 IP 192.168.12.2.137 > 192.168.12.99.137: UDP, length 50
11:36:25.961186 IP lap-sivan01.137 > 192.168.12.99.137: UDP, length 50
11:36:27.460493 IP 192.168.12.2.137 > 192.168.12.99.137: UDP, length 50
11:36:27.460622 IP lap-sivan01.137 > 192.168.12.99.137: UDP, length 50
11:36:28.960488 IP 192.168.12.2.137 > 192.168.12.99.137: UDP, length 50
11:36:28.960645 IP lap-sivan01.137 > 192.168.12.99.137: UDP, length 50
11:36:30.460968 IP 192.168.12.2.137 > 192.168.12.99.137: UDP, length 50
11:36:30.461149 IP lap-sivan01.137 > 192.168.12.99.137: UDP, length 50
11:36:30.677707 IP 192.168.12.99.23 > 192.168.12.2.1261: S 1480:1480(0) ack 1835
90925 win 1446 <mss 1446>
11:36:31.960540 IP 192.168.12.2.137 > 192.168.12.99.137: UDP, length 50
11:36:31.960688 IP lap-sivan01.137 > 192.168.12.99.137: UDP, length 50
11:36:33.460509 IP 192.168.12.2.137 > 192.168.12.99.137: UDP, length 50
11:36:33.460639 IP lap-sivan01.137 > 192.168.12.99.137: UDP, length 50

31 packets captured
31 packets received by filter
0 packets dropped by kernel

C:\files\Papers\embedded\LPC2148\usb_eth>
C:\files\Papers\embedded\LPC2148\usb_eth>c:\programs\WinDump -i \Device\NPF_{45E
6593F-7A29-447A-8B39-EFADBBF19877}
c:\programs\WinDump: listening on \Device\NPF_{45E6593F-7A29-447A-8B39-EFADBBF19
877}
11:38:46.547863 arp who-has 192.168.12.99 tell 192.168.12.2
11:38:46.617253 arp reply 192.168.12.99 is-at de:ad:be:ef:ab:ba (oui Unknown)
11:38:46.617283 IP 192.168.12.2.1272 > 192.168.12.99.23: S 3949349693:3949349693
(0) win 16384 <mss 1460,nop,nop,sackOK>
11:38:46.868920 IP lap-sivan01.137 > 192.168.12.99.137: UDP, length 50
11:38:46.968269 IP 192.168.12.99.23 > 192.168.12.2.1272: S 7480:7480(0) ack 3949
349694 win 1446 <mss 1446>
11:38:48.368567 IP lap-sivan01.137 > 192.168.12.99.137: UDP, length 50
11:38:49.502558 IP 192.168.12.2.1272 > 192.168.12.99.23: S 3949349693:3949349693
(0) win 16384 <mss 1460,nop,nop,sackOK>
11:38:49.797386 IP 192.168.12.99.23 > 192.168.12.2.1272: . ack 1 win 1446
11:38:49.868553 IP lap-sivan01.137 > 192.168.12.99.137: UDP, length 50
11:38:50.056374 IP 192.168.12.99.23 > 192.168.12.2.1272: S 7480:7480(0) ack 3949
349694 win 1446 <mss 1446>
11:38:51.369168 IP lap-sivan01.137 > 192.168.12.99.137: UDP, length 50
11:38:52.868596 IP lap-sivan01.137 > 192.168.12.99.137: UDP, length 50
11:38:54.109497 IP 192.168.12.99.23 > 192.168.12.2.1272: S 7480:7480(0) ack 3949
349694 win 1446 <mss 1446>
11:38:54.368593 IP lap-sivan01.137 > 192.168.12.99.137: UDP, length 50
11:38:55.437852 IP 192.168.12.2.1272 > 192.168.12.99.23: S 3949349693:3949349693
(0) win 16384 <mss 1460,nop,nop,sackOK>
11:38:55.732562 IP 192.168.12.99.23 > 192.168.12.2.1272: . ack 1 win 1446
11:39:01.181737 IP 192.168.12.99.23 > 192.168.12.2.1272: S 7480:7480(0) ack 3949
349694 win 1446 <mss 1446>

17 packets captured
17 packets received by filter
0 packets dropped by kernel

C:\files\Papers\embedded\LPC2148\usb_eth>c:\programs\WinDump -i \Device\NPF_{45E
6593F-7A29-447A-8B39-EFADBBF19877}
c:\programs\WinDump: listening on \Device\NPF_{45E6593F-7A29-447A-8B39-EFADBBF19
877}
11:48:53.734137 arp who-has 192.168.12.99 tell 192.168.12.2
11:48:53.803620 arp reply 192.168.12.99 is-at de:ad:be:ef:ab:ba (oui Unknown)
11:48:53.803635 IP 192.168.12.2.1283 > 192.168.12.99.23: S 770086500:770086500(0
) win 16384 <mss 1496,nop,nop,sackOK>
11:48:53.989162 IP lap-sivan01.137 > 192.168.12.99.137: UDP, length 50
11:48:54.154628 IP 192.168.12.99.23 > 192.168.12.2.1283: S 2200:2200(0) ack 7700
86501 win 1446 <mss 1446>
11:48:55.489149 IP lap-sivan01.137 > 192.168.12.99.137: UDP, length 50
11:48:56.744006 IP 192.168.12.2.1283 > 192.168.12.99.23: S 770086500:770086500(0
) win 16384 <mss 1496,nop,nop,sackOK>
11:48:56.989167 IP lap-sivan01.137 > 192.168.12.99.137: UDP, length 50
11:48:57.058712 IP 192.168.12.99.23 > 192.168.12.2.1283: . ack 1 win 1446
11:48:57.174732 IP 192.168.12.99.23 > 192.168.12.2.1283: S 2200:2200(0) ack 7700
86501 win 1446 <mss 1446>
11:48:58.489668 IP lap-sivan01.137 > 192.168.12.99.137: UDP, length 50
11:48:59.989181 IP lap-sivan01.137 > 192.168.12.99.137: UDP, length 50
11:49:01.228870 IP 192.168.12.99.23 > 192.168.12.2.1283: S 2200:2200(0) ack 7700
86501 win 1446 <mss 1446>
11:49:01.489194 IP lap-sivan01.137 > 192.168.12.99.137: UDP, length 50
11:49:02.779193 IP 192.168.12.2.1283 > 192.168.12.99.23: S 770086500:770086500(0
) win 16384 <mss 1496,nop,nop,sackOK>
11:49:03.073934 IP 192.168.12.99.23 > 192.168.12.2.1283: . ack 1 win 1446
11:49:03.477652 IP 192.168.12.2.5353 > 224.0.0.251.5353:  0 [2a] PTR? _sip._udp.
local. (146)
11:49:04.124054 IP 192.168.12.2.5353 > 224.0.0.251.5353:  0*- [0q] 9/0/0[|domain
]
11:49:08.338129 IP 192.168.12.99.23 > 192.168.12.2.1283: S 2200:2200(0) ack 7700
86501 win 1446 <mss 1446>
11:49:21.355542 IP 192.168.12.99.23 > 192.168.12.2.1283: S 2200:2200(0) ack 7700
86501 win 1446 <mss 1446>
11:49:46.371357 IP 192.168.12.99.23 > 192.168.12.2.1283: S 2200:2200(0) ack 7700
86501 win 1446 <mss 1446>
11:50:07.484766 IP 192.168.12.2.5353 > 224.0.0.251.5353:  0 [2a] PTR? _sip._udp.
local. (146)
11:50:08.123375 IP 192.168.12.2.5353 > 224.0.0.251.5353:  0*- [0q] 5/0/0[|domain
]
11:50:35.420928 IP 192.168.12.99.23 > 192.168.12.2.1283: R 0:0(0) ack 1 win 1446


24 packets captured
24 packets received by filter
0 packets dropped by kernel

C:\files\Papers\embedded\LPC2148\usb_eth>